{
  "schema_name": "SystemRunV1",
  "schema_version": "1.0.0",
  "record_id": "system-run-synthetic-a",
  "run_id": "synthetic-run-a",
  "run_class": "synthetic",
  "system": {
    "name": "synthetic-system",
    "version": "a",
    "digest": {"algorithm": "sha256", "value": "aaaaaaaaaaaaaaaaaaaaaaaaaaaaaaaaaaaaaaaaaaaaaaaaaaaaaaaaaaaaaaaa"}
  },
  "task_contract": {
    "task_id": "synthetic-rally-boundaries",
    "prediction_unit": "rally_boundary",
    "boundary_tolerance_frames": 15,
    "scorer_name": "khelsutra-rally-boundary",
    "scorer_version": "1.0.0"
  },
  "samples": [
    {
      "sample_id": "synthetic-match-001",
      "status": "accepted",
      "prediction_ref": {"artifact_id": "prediction-synthetic-match-001", "digest": {"algorithm": "sha256", "value": "bbbbbbbbbbbbbbbbbbbbbbbbbbbbbbbbbbbbbbbbbbbbbbbbbbbbbbbbbbbbbbbb"}},
      "manual_correction_minutes": 5
    }
  ],
  "scenario_strata": ["multi-active-fixed"],
  "metrics": [
    {"name": "tol_f1", "value": 0.6666666666666666, "unit": "ratio", "numerator": 2, "denominator": 3, "stratum": "multi-active-fixed"},
    {"name": "adjacent_court_false_events_per_source_hour", "value": 6, "unit": "events/source-hour", "numerator": 1, "denominator": 0.16666666666666666, "stratum": "multi-active-fixed"}
  ],
  "timings": [
    {"phase": "first_stable_rally", "elapsed_seconds": 45},
    {"phase": "delivery_complete", "elapsed_seconds": 700}
  ],
  "cost_receipt": {
    "schema_name": "CostReceiptV1",
    "schema_version": "1.0.0",
    "record_id": "cost-synthetic-run-a",
    "currency": "USD",
    "source_seconds": 600,
    "accepted_source_seconds": 600,
    "inference_usd": 0.2,
    "accelerator_seconds": 480,
    "wall_seconds": 660,
    "retry_usd": 0.01,
    "manual_review_minutes": 5,
    "total_cost_usd": 0.5,
    "inference_usd_per_source_hour": 1.2,
    "accelerator_seconds_per_source_hour": 2880,
    "wall_seconds_per_source_hour": 3960,
    "manual_minutes_per_source_hour": 30,
    "total_cost_usd_per_accepted_source_hour": 3
  },
  "failures_included": true,
  "notes": "Synthetic contract fixture; not product evidence."
}
